A1: Accounts | B1: Period 1 | C1: Period 2 | D1: Period 3 | E1: Period 4 | F1: Period 5 | G1: Period 6 | H1: Period 7 | I1: Period 8 | J1: Period 9 | K1: Period 10 | L1: Period 11 | M1: Period 12
A3: 1.500.401 | B3: 101 | C3: 102 | D3: 103 | E3: 104 | F3: 105 | G3: 106 | H3: 107 | I3: 108 | J3: 109 | K3: 110 | L3: 111 | M3: 112
A4: 1.500.402 | B4: 201 | C4: 202 | D4: 203 | E4: 204 | F4: 205 | G4: 206 | H4: 207 | I4: 208 | J4: 209 | K4: 210 | L4: 211 | M4: 212
A5: 1.500.403 | B5: 301 | C5: 302 | D5: 303 | E5: 304 | F5: 305 | G5: 306 | H5: 307 | I5: 308 | J5: 309 | K5: 310 | L5: 311 | M5: 312
A6: 1.5049999999999999 | B6: 401 | C6: 402 | D6: 403 | E6: 404 | F6: 405 | G6: 406 | H6: 407 | I6: 408 | J6: 409 | K6: 410 | L6: 411 | M6: 412
A7: 1.500.405 | B7: 501 | C7: 502 | D7: 503 | E7: 504 | F7: 505 | G7: 506 | H7: 507 | I7: 508 | J7: 509 | K7: 510 | L7: 511 | M7: 512
A8: 1.500.406 | B8: 601 | C8: 602 | D8: 603 | E8: 604 | F8: 605 | G8: 606 | H8: 607 | I8: 608 | J8: 609 | K8: 610 | L8: 611 | M8: 612
A9: 1.500.407 | B9: =SUM(B3:B8) -> 2106 | C9: =SUM(C3:C8) -> 2112 | D9: =SUM(D3:D8) -> 2118 | E9: =SUM(E3:E8) -> 2124 | F9: =SUM(F3:F8) -> 2130 | G9: =SUM(G3:G8) -> 2136 | H9: =SUM(H3:H8) -> 2142 | I9: =SUM(I3:I8) -> 2148 | J9: =SUM(J3:J8) -> 2154 | K9: =SUM(K3:K8) -> 2160 | L9: =SUM(L3:L8) -> 2166 | M9: =SUM(M3:M8) -> 2172